{
  "$schema": "https://json-schema.org/draft/2020-12/schema",
  "$id": "chapter.schema.json",
  "title": "Developer Journey Chapter",
  "type": "object",
  "required": [
    "schema_version",
    "id",
    "title",
    "steps"
  ],
  "properties": {
    "schema_version": {
      "const": 1
    },
    "id": {
      "type": "string",
      "minLength": 1
    },
    "title": {
      "type": "string",
      "minLength": 1
    },
    "subtitle": {
      "type": "string"
    },
    "steps": {
      "type": "array",
      "minItems": 1,
      "items": {
        "type": "object",
        "required": [
          "title",
          "why",
          "highlight",
          "action"
        ],
        "properties": {
          "title": {
            "type": "string",
            "minLength": 1
          },
          "why": {
            "type": "string",
            "minLength": 1
          },
          "software": {
            "type": "string",
            "minLength": 1
          },
          "highlight": {
            "type": "object",
            "required": [
              "kind"
            ],
            "properties": {
              "kind": {
                "enum": [
                  "code",
                  "target",
                  "none"
                ]
              },
              "reason": {
                "type": "string",
                "minLength": 1
              },
              "line": {
                "type": "integer",
                "minimum": 1
              },
              "lines": {
                "type": "array",
                "minItems": 1,
                "items": {
                  "type": "integer",
                  "minimum": 1
                }
              },
              "selector": {
                "type": "string",
                "minLength": 1
              },
              "selectors": {
                "type": "array",
                "minItems": 1,
                "items": {
                  "type": "string",
                  "minLength": 1
                }
              },
              "text": {
                "type": "string",
                "minLength": 1
              },
              "scope": {
                "type": "string",
                "minLength": 1
              },
              "preserveHorizontal": {
                "type": "boolean"
              }
            },
            "additionalProperties": false
          },
          "action": {
            "type": "object",
            "required": [
              "action"
            ],
            "properties": {
              "action": {
                "type": "string",
                "minLength": 1
              },
              "data": {}
            },
            "additionalProperties": true
          }
        },
        "additionalProperties": true
      }
    }
  },
  "additionalProperties": true
}
